"A Cryptographic Look at Multi-party Channels","P. Eugster; G. A. Marson; B. Poettering","Univ. of Lugano, Lugano, Switzerland; NEC Labs. Eur., Heidelberg, Germany; R. Holloway, Univ. of London Egham, Egham, UK","2018 IEEE 31st Computer Security Foundations Symposium (CSF)","9 Aug 2018","2018","","","31","45","Cryptographic channels aim to enable authenticated and confidential communication over the Internet. The general understanding seems to be that providing security in the sense of authenticated encryption for every (unidirectional) point-to-point link suffices to achieve this goal. As recently shown (in FSE17/ToSC17), however, the security properties of the unidirectional links do not extend, in general, to the bidirectional channel as a whole. Intuitively, the reason for this is that the increased interaction in bidirectional communication can be exploited by an adversary. The same applies, a fortiori, in a multi-party setting where several users operate concurrently and the communication develops in more directions. In the cryptographic literature, however, the targeted goals for group communication in terms of channel security are still unexplored. Applying the methodology of provable security, we fill this gap by defining exact (game-based) authenticity and confidentiality goals for broadcast communication, and showing how to achieve them. Importantly, our security notions also account for the causal dependencies between exchanged messages, thus naturally extending the bidirectional case where causal relationships are automatically captured by preserving the sending order. On the constructive side we propose a modular and yet efficient protocol that, assuming only point-to-point links between users, leverages (non-cryptographic) broadcast and standard cryptographic primitives to a full-fledged broadcast channel that provably meets the security notions we put forth.","2374-8303","978-1-5386-6680-7","10.1109/CSF.2018.00010","","https://ieeexplore.ieee.org/stamp/stamp.jsp?arnumber=8429294","secure-channels,-broadcast-communication,-causality-preservation,-integrity,-confidentiality","Protocols;Servers;Reliability;Internet;Encryption","broadcast channels;broadcast communication;computer network security;cryptographic protocols;Internet","protocol;game-based authenticity;Internet;FSE17-ToSC17;point-to-point link;channel security;group communication;bidirectional communication;bidirectional channel;unidirectional links;security properties;authenticated encryption;confidential communication;authenticated communication;cryptographic channels;multiparty channels;full-fledged broadcast channel;standard cryptographic primitives;point-to-point links;broadcast communication;provable security","","","","40","","9 Aug 2018","","","IEEE","IEEE Conferences"
"A Survey on Machine Learning Techniques for Cyber Security in the Last Decade","K. Shaukat; S. Luo; V. Varadharajan; I. A. Hameed; M. Xu","School of Electrical Engineering and Computing, The University of Newcastle, Callaghan, NSW, Australia; School of Electrical Engineering and Computing, The University of Newcastle, Callaghan, NSW, Australia; School of Electrical Engineering and Computing, The University of Newcastle, Callaghan, NSW, Australia; Department of ICT and Natural Sciences, Norwegian University of Science and Technology, Trondheim, Norway; School of Electrical and Data Engineering, University of Technology Sydney, Ultimo, NSW, Australia","IEEE Access","21 Dec 2020","2020","8","","222310","222354","Pervasive growth and usage of the Internet and mobile applications have expanded cyberspace. The cyberspace has become more vulnerable to automated and prolonged cyberattacks. Cyber security techniques provide enhancements in security measures to detect and react against cyberattacks. The previously used security systems are no longer sufficient because cybercriminals are smart enough to evade conventional security systems. Conventional security systems lack efficiency in detecting previously unseen and polymorphic security attacks. Machine learning (ML) techniques are playing a vital role in numerous applications of cyber security. However, despite the ongoing success, there are significant challenges in ensuring the trustworthiness of ML systems. There are incentivized malicious adversaries present in the cyberspace that are willing to game and exploit such ML vulnerabilities. This paper aims to provide a comprehensive overview of the challenges that ML techniques face in protecting cyberspace against attacks, by presenting a literature on ML techniques for cyber security including intrusion detection, spam detection, and malware detection on computer networks and mobile networks in the last decade. It also provides brief descriptions of each ML method, frequently used security datasets, essential ML tools, and evaluation metrics to evaluate a classification model. It finally discusses the challenges of using ML techniques in cyber security. This paper provides the latest extensive bibliography and the current trends of ML in cyber security.","2169-3536","","10.1109/ACCESS.2020.3041951","Norwegian University of Science and Technology, Norway; ","https://ieeexplore.ieee.org/stamp/stamp.jsp?arnumber=9277523","Cyber security;deep learning;intrusion detection;malware;machine learning;spam","Computer crime;Machine learning;Internet;Deep learning;Market research;Malware;Intrusion detection","Internet;invasive software;learning (artificial intelligence);mobile computing","security systems;unseen security attacks;polymorphic security attacks;machine learning;ML systems;cyberspace;cyber security;security datasets;intrusion detection;spam detection;malware detection;Internet;mobile applications","","17","","668","CCBY","2 Dec 2020","","","IEEE","IEEE Journals"
"Adversarial Attacks on Cognitive Self-Organizing Networks: The Challenge and the Way Forward","M. Usama; J. Qadir; A. Al-Fuqaha","Information Technology University, Punjab, Pakistan; Information Technology University, Punjab, Pakistan; Western Michigan University, USA","2018 IEEE 43rd Conference on Local Computer Networks Workshops (LCN Workshops)","31 Jan 2019","2018","","","90","97","Future communications and data networks are expected to be largely cognitive self-organizing networks (CSON). Such networks will have the essential property of cognitive self-organization, which can be achieved using machine learning techniques (e.g., deep learning). Despite the potential of these techniques, these techniques in their current form are vulnerable to adversarial attacks that can cause cascaded damages with detrimental consequences for the whole network. In this paper, we explore the effect of adversarial attacks on CSON. Our experiments highlight the level of threat that CSON have to deal with in order to meet the challenges of next-generation networks and point out promising directions for future work.","","978-1-5386-5097-4","10.1109/LCNW.2018.8628538","","https://ieeexplore.ieee.org/stamp/stamp.jsp?arnumber=8628538","","Malware;Perturbation methods;Gray-scale;Convolution;Neural networks;Feature extraction;Conferences","cognitive systems;learning (artificial intelligence);security of data;self-organising feature maps","adversarial attacks;data networks;CSON;cognitive self-organization;machine learning techniques;deep learning;next-generation networks;cognitive self-organizing networks","","9","","40","","31 Jan 2019","","","IEEE","IEEE Conferences"
"The Future of Healthcare Internet of Things: A Survey of Emerging Technologies","Y. A. Qadri; A. Nauman; Y. B. Zikria; A. V. Vasilakos; S. W. Kim","Department of Information and Communication Engineering, Yeungnam University, Gyeongsan, South Korea; Department of Information and Communication Engineering, Yeungnam University, Gyeongsan, South Korea; Department of Information and Communication Engineering, Yeungnam University, Gyeongsan, South Korea; College of Mathematics and Computer Science, Fuzhou University, Fuzhou, China; Department of Information and Communication Engineering, Yeungnam University, Gyeongsan, South Korea","IEEE Communications Surveys & Tutorials","27 May 2020","2020","22","2","1121","1167","The impact of the Internet of Things (IoT) on the advancement of the healthcare industry is immense. The ushering of the Medicine 4.0 has resulted in an increased effort to develop platforms, both at the hardware level as well as the underlying software level. This vision has led to the development of Healthcare IoT (H-IoT) systems. The basic enabling technologies include the communication systems between the sensing nodes and the processors; and the processing algorithms for generating an output from the data collected by the sensors. However, at present, these enabling technologies are also supported by several new technologies. The use of Artificial Intelligence (AI) has transformed the H-IoT systems at almost every level. The fog/edge paradigm is bringing the computing power close to the deployed network and hence mitigating many challenges in the process. While the big data allows handling an enormous amount of data. Additionally, the Software Defined Networks (SDNs) bring flexibility to the system while the blockchains are finding the most novel use cases in H-IoT systems. The Internet of Nano Things (IoNT) and Tactile Internet (TI) are driving the innovation in the H-IoT applications. This paper delves into the ways these technologies are transforming the H-IoT systems and also identifies the future course for improving the Quality of Service (QoS) using these new technologies.","1553-877X","","10.1109/COMST.2020.2973314","Brain Korea 21 Plus Program funded by the National Research Foundation of Korea (NRF)(grant numbers:22A20130012814); Ministry of Science and ICT, South Korea, through the Information Technology Research Center support program supervised by the Institute for Information and Communications Technology Planning and Evaluation (IITP)(grant numbers:IITP-2019-2016-0-00313); Basic Science Research Program through NRF funded by the Ministry of Education(grant numbers:2018R1D1A1A09082266); ","https://ieeexplore.ieee.org/stamp/stamp.jsp?arnumber=8993839","H-IoT;WBAN;machine learning;fog computing;edge computing;blockchain;software defined networks","Internet of Things;Medical services;Edge computing;Sensors;Blockchain;Quality of service;Big Data","artificial intelligence;Big Data;biomedical communication;health care;Internet of Things;quality of service;software defined networking","hardware level;software level;healthcare IoT systems;communication systems;H-IoT systems;Internet of NanoThings;tactile Internet;H-IoT applications;healthcare Internet of Things;healthcare industry;software defined networks;Medicine 4.0;artificial intelligence;big data;quality of service;QoS","","40","","260","IEEE","11 Feb 2020","","","IEEE","IEEE Journals"
"A Spatiotemporal and Multivariate Attribute Correlation Extraction Scheme for Detecting Abnormal Nodes in WSNs","N. Berjab; H. H. Le; H. Yokota","Tokyo Institute of Technology, Tokyo, Japan; Tokyo Institute of Technology, Tokyo, Japan; Tokyo Institute of Technology, Tokyo, Japan","IEEE Access","7 Oct 2021","2021","9","","135266","135284","Many heterogeneous sensors exhibit strong spatio-temporal correlations that can be used to enhance the abnormal node detection problem in a wireless sensor network (WSN). Corruption in these correlations has been shown effective in detecting false data injection attacks. In this paper, we adopt a new cross-correlation-based method to extract the sensor relationships. It utilizes the observed spatiotemporal (ST) and multivariate-attribute (MVA) sensor correlations to decide whether the sensor is subject to abnormalities or represents actual events. Based on the ST correlations, the cross-correlation is extracted in both space and time by conducting shape-based logical subclustering and two-phase analysis methods. In the first analysis phase, the system uses a variable-size sliding window and a median absolute deviation (MAD) measure. If the collected sensor data streams output a certain percentage of anomalous points, the MAD will flag these points as anomalous measurements, and all the sensor data and the window size will be passed to the second analysis phase. The latter performs both tumbling-window and sliding-window analyses to extract multicriteria cross-correlation measures. Finally, all the extracted sensor time-series features will be fed to the shape-based clustering to generate a sensor similarity-like graph. The latter reflects the similarity degree of the sensor with the other nodes. The nodes with a low similarity degree below the threshold will be identified as candidate abnormal nodes. Based on the observed MVA correlations, a set consisting of a few rules is introduced to check whether the detected candidate abnormal nodes represent actual events. Finally, if abnormal nodes exist, then such nodes are reported. Our experiments using two real-world datasets demonstrate that our proposed approach detects abnormal nodes with an average accuracy of 96.50%, an average precision of 88.69%, and a recall rate of 93.00%.","2169-3536","","10.1109/ACCESS.2021.3115819","New Energy and Industrial Technology Development Organization (NEDO)(grant numbers:JPNP 16007); ","https://ieeexplore.ieee.org/stamp/stamp.jsp?arnumber=9548894","Anomaly detection;Internet of Things;sensor data correlations;wireless sensor networks;false data injection attacks","Sensors;Wireless sensor networks;Correlation;Anomaly detection;Sensor phenomena and characterization;Sensor systems;Intelligent sensors","correlation methods;pattern clustering;spatiotemporal phenomena;time series;wireless sensor networks","multicriteria cross-correlation measures;extracted sensor time-series features;sensor similarity-like graph;observed MVA correlations;detected candidate abnormal nodes;actual events;heterogeneous sensors;strong spatio-temporal correlations;abnormal node detection problem;wireless sensor network;false data injection attacks;cross-correlation-based method;sensor relationships;observed spatiotemporal;multivariate-attribute sensor correlations;ST correlations;shape-based logical subclustering;two-phase analysis methods;analysis phase;variable-size sliding window;median absolute deviation measure;MAD;collected sensor data streams output;anomalous points;anomalous measurements;window size;tumbling-window;sliding-window analyses","","","","33","CCBY","27 Sep 2021","","","IEEE","IEEE Journals"
"Classification of Exploit-Kit behaviors via machine learning approach","S. Harnmetta; S. Ngamsuriyaroj","Faculty of Information and Communication Technology, Mahidol University, Nakornpathom, Thailand; Faculty of Information and Communication Technology, Mahidol University, Nakornpathom, Thailand","2018 20th International Conference on Advanced Communication Technology (ICACT)","26 Mar 2018","2018","","","468","473","An Exploit-Kit (EK) is the cyber attacking tool which targets in finding vulnerabilities appeared on a web browser instance such as web-plugins, add-on instances usually installed in a web browser. Such instances may send some suitable malware payload through the vulnerabilities they found. This kind of such cyber-attack is known as the drive-by-download attack where malware downloading do not require any interaction from users. In addition, EK can do self-protection by imitating a benign website or responding to end-users with HTTP 404 error code whenever it encountered an unsupported target web browser. As a result, detecting EK requires a lot of effort. However, when an EK launches an attack, there are some patterns of interactions between a host and a victim. In this work, we obtain a set of data from www.malware-traffic-analysis.net and analyze those interactions in order to identify a set of features. We use such features to build a model for classifying interaction patterns of each EK type. Our experiments show that, with 5,743 network flows and 45 features, our model using Decision tree approach can classify EK traffic and EK type with accuracy of 97.74% and 97.11% respectively. In conclusion, our proposed work can help detect the behavior of EK with high accuracy.","","979-11-88428-01-4","10.23919/ICACT.2018.8323798","","https://ieeexplore.ieee.org/stamp/stamp.jsp?arnumber=8323798","Drive-by-Download;Exploit-Kit;Machine Learning;Network Analysis","Feature extraction;Malware;Telecommunication traffic;Uniform resource locators;Browsers;Computer security;Decision trees","decision trees;Internet;invasive software;learning (artificial intelligence);online front-ends","exploit-kit behaviors;Web browser instance;Web-plugins;malware payload;EK traffic;EK type;interaction patterns;HTTP 404 error code;malware downloading;drive-by-download attack;cyber-attack;finding vulnerabilities;cyber attacking tool","","1","","15","","26 Mar 2018","","","IEEE","IEEE Conferences"
"Enhancing Challenge-based Collaborative Intrusion Detection Against Insider Attacks using Spatial Correlation","W. Li; W. Meng; J. Parra-Arnau; K. -K. R. Choo","Technical University of Denmark,Department of Applied Mathematics and Computer Science,Denmark; Technical University of Denmark,Department of Applied Mathematics and Computer Science,Denmark; Karlsruhe Institute of Technology,Germany; University of Texas at San Antonio,Department of Information Systems and Cyber Security,USA","2021 IEEE Conference on Dependable and Secure Computing (DSC)","10 Feb 2021","2021","","","1","8","With cyber-attacks becoming more complicated and the networks increasingly interconnected, there has been a move towards using collaborative intrusion detection networks (CIDNs) to identify cyber-threats more effectively. However, insider attacks may remain challenging to mitigate in CIDNs, as the intruders are able to control one or more internal nodes. Challenge- based trust mechanism is one promising solution to help safeguard CIDNs against common insider attacks, but not necessarily against advanced attacks such as passive message fingerprint attacks. In this work, we focus on challenge-based trust mechanism and advocate that considering additional level of trust can enhance the robustness of CIDNs. Specifically, we design an enhanced trust management scheme by checking spatial correlation among nodes' behavior, regarding forwarding delay, packet dropping and sending rate. Then, we evaluate our approach in a simulated environment, as well as a realworld environment in collaboration with an IT organization. Experimental results demonstrate that our approach can help enhance the robustness of challenge-based trust mechanism by detecting malicious nodes faster than similar approaches (i.e., reducing time consumption by two to three days).","","978-1-7281-7534-8","10.1109/DSC49826.2021.9346232","National Natural Science Foundation of China(grant numbers:61802077); ","https://ieeexplore.ieee.org/stamp/stamp.jsp?arnumber=9346232","Collaborative Intrusion Detection;Spatial Correlation;Advanced Insider Threat;Challenge-based Trust Management;Trust Computation","Correlation;Collaboration;Intrusion detection;Organizations;Fingerprint recognition;Robustness;Trust management","computer network security;trusted computing","enhanced trust management scheme;spatial correlation;challenge-based collaborative intrusion detection;challenge-based trust mechanism;passive message fingerprint attacks;common insider attacks;internal nodes;CIDNs;collaborative intrusion detection networks;cyber-attacks","","","","43","","10 Feb 2021","","","IEEE","IEEE Conferences"
"Video Big Data Analytics in the Cloud: A Reference Architecture, Survey, Opportunities, and Open Research Issues","A. Alam; I. Ullah; Y. -K. Lee","Department of Computer Science and Engineering, Kyung Hee University (Global Campus), Yongin, South Korea; Department of Computer Science and Engineering, Kyung Hee University (Global Campus), Yongin, South Korea; Department of Computer Science and Engineering, Kyung Hee University (Global Campus), Yongin, South Korea","IEEE Access","26 Aug 2020","2020","8","","152377","152422","The proliferation of multimedia devices over the Internet of Things (IoT) generates an unprecedented amount of data. Consequently, the world has stepped into the era of big data. Recently, on the rise of distributed computing technologies, video big data analytics in the cloud has attracted the attention of researchers and practitioners. The current technology and market trends demand an efficient framework for video big data analytics. However, the current work is too limited to provide a complete survey of recent research work on video big data analytics in the cloud, including the management and analysis of a large amount of video data, the challenges, opportunities, and promising research directions. To serve this purpose, we present this study, which conducts a broad overview of the state-of-the-art literature on video big data analytics in the cloud. It also aims to bridge the gap among large-scale video analytics challenges, big data solutions, and cloud computing. In this study, we clarify the basic nomenclatures that govern the video analytics domain and the characteristics of video big data while establishing its relationship with cloud computing. We propose a service-oriented layered reference architecture for intelligent video big data analytics in the cloud. Then, a comprehensive and keen review has been conducted to examine cutting-edge research trends in video big data analytics. Finally, we identify and articulate several open research issues and challenges, which have been raised by the deployment of big data technologies in the cloud for video big data analytics. To the best of our knowledge, this is the first study that presents the generalized view of the video big data analytics in the cloud. This paper provides the research studies and technologies advancing the video analyses in the era of big data and cloud computing.","2169-3536","","10.1109/ACCESS.2020.3017135","Institute for Information and Communications Technology Promotion Grant through the Korean Government (MSIT) (SIAT CCTV Cloud Platform)(grant numbers:R7120-17-1007); ","https://ieeexplore.ieee.org/stamp/stamp.jsp?arnumber=9169636","Big data;intelligent video analytics;cloud-based video analytics system;video analytics survey;deep learning;distributed computing;intermediate results orchestration;cloud computing","Big Data;Cloud computing;Streaming media;Computer architecture;Surveillance;Market research;Cameras","Big Data;cloud computing;Internet of Things;video signal processing","intelligent video Big Data analytics;multimedia devices;Internet of Things;IoT;service-oriented layered reference architecture;cloud computing","","1","","404","CCBY","17 Aug 2020","","","IEEE","IEEE Journals"
"Detection of Phishing websites using Generative Adversarial Network","P. Robic-Butez; T. Y. Win","University of Gloucestershire & INSA CVL,Department of Computer Science,Cheltenham,United Kingdom & Bourges, France; University of Gloucestershire,School of Business & Technology,Cheltenham,United Kingdom","2019 IEEE International Conference on Big Data (Big Data)","24 Feb 2020","2019","","","3216","3221","Phishing is typically deployed as an attack vector in the initial stages of a hacking endeavour. Due to it low-risk rightreward nature it has seen a widespread adoption, and detecting it has become a challenge in recent times. This paper proposes a novel means of detecting phishing websites using a Generative Adversarial Network. Taking into account the internal structure and external metadata of a website, the proposed approach uses a generator network which generates both legitimate as well as synthetic phishing features to train a discriminator network. The latter then determines if the features are either normal or phishing websites, before improving its detection accuracy based on the classification error. The proposed approach is evaluated using two different phishing datasets and is found to achieve a detection accuracy of up to 94%.","","978-1-7281-0858-2","10.1109/BigData47090.2019.9006352","","https://ieeexplore.ieee.org/stamp/stamp.jsp?arnumber=9006352","security analytics;phishing detection;generative adversarial networks;cloud security;big data analytics","Phishing;Feature extraction;Training;Uniform resource locators;Gallium nitride;Generators;Generative adversarial networks","computer crime;meta data;neural nets;pattern classification;Web sites","phishing Websites;Generative Adversarial Network;attack vector;hacking endeavour;low-risk rightreward nature;internal structure;external metadata;generator network;synthetic phishing features;discriminator network;phishing datasets;normal Websites","","","","15","","24 Feb 2020","","","IEEE","IEEE Conferences"
