"A Survey and a Layered Taxonomy of Software-Defined Networking","Y. Jarraya; T. Madi; M. Debbabi","Concordia Inst. for Inf. Syst. Eng., Concordia Univ., Montreal, QC, Canada; Concordia Inst. for Inf. Syst. Eng., Concordia Univ., Montreal, QC, Canada; Concordia Inst. for Inf. Syst. Eng., Concordia Univ., Montreal, QC, Canada","IEEE Communications Surveys & Tutorials","20 Nov 2014","2014","16","4","1955","1980","Software-defined networking (SDN) has recently gained unprecedented attention from industry and research communities, and it seems unlikely that this will be attenuated in the near future. The ideas brought by SDN, although often described as a “revolutionary paradigm shift” in networking, are not completely new since they have their foundations in programmable networks and control-data plane separation projects. SDN promises simplified network management by enabling network automation, fostering innovation through programmability, and decreasing CAPEX and OPEX by reducing costs and power consumption. In this paper, we aim at analyzing and categorizing a number of relevant research works toward realizing SDN promises. We first provide an overview on SDN roots and then describe the architecture underlying SDN and its main components. Thereafter, we present existing SDN-related taxonomies and propose a taxonomy that classifies the reviewed research works and brings relevant research directions into focus. We dedicate the second part of this paper to studying and comparing the current SDN-related research initiatives and describe the main issues that may arise due to the adoption of SDN. Furthermore, we review several domains where the use of SDN shows promising results. We also summarize some foreseeable future research challenges.","1553-877X","","10.1109/COMST.2014.2320094","","https://ieeexplore.ieee.org/stamp/stamp.jsp?arnumber=6805151","Software-defined networking;OpenFlow;programmable networks;controller;management;virtualization;flow","Control systems;Taxonomy;Software defined networking;Ports (Computers);Network operating systems","power consumption;software radio;telecommunication network management;telecommunication power management","software defined networking;SDN;layered taxonomy;revolutionary paradigm shift;programmable networks;control-data plane separation projects;simplified network management;network automation;fostering innovation;programmability;CAPEX;OPEX;power consumption","","211","","169","IEEE","24 Apr 2014","","","IEEE","IEEE Journals"
"Analyzing Root Causes of Intrusion Detection False-Negatives: Methodology and Case Study","E. Ficke; K. M. Schweitzer; R. M. Bateman; S. Xu","University of Texas at San Antonio,Department of Computer Science; U.S. Army Research Laboratory South-Cyber; U.S. Army Research Laboratory South-Cyber; University of Texas at San Antonio,Department of Computer Science","MILCOM 2019 - 2019 IEEE Military Communications Conference (MILCOM)","5 Mar 2020","2019","","","1","6","Intrusion Detection Systems (IDSs) are a necessary cyber defense mechanism. Unfortunately, their capability has fallen behind that of attackers. This motivates us to improve our understanding of the root causes of their false-negatives. In this paper we make a first step towards the ultimate goal of drawing useful insights and principles that can guide the design of next-generation IDSs. Specifically, we propose a methodology for analyzing the root causes of IDS false-negatives and conduct a case study based on Snort and a real-world dataset of cyber attacks. The case study allows us to draw useful insights.","2155-7586","978-1-7281-4280-7","10.1109/MILCOM47813.2019.9020860","","https://ieeexplore.ieee.org/stamp/stamp.jsp?arnumber=9020860","Intrusion Detection;Intrusion Detection Systems;Root Cause Analysis;False Negatives;Snort;Suricata;Flow-based Intrusion Detection","Intrusion detection;Databases;Protocols;Cyberattack;IP networks;Next generation networking;Payloads","security of data","root causes analysis;intrusion detection false-negatives;intrusion detection systems;cyber defense mechanism;next-generation IDSs;IDS false-negatives;cyber attacks","","1","","30","","5 Mar 2020","","","IEEE","IEEE Conferences"
"BAD: A Blockchain Anomaly Detection Solution","M. Signorini; M. Pontecorvi; W. Kanoun; R. Di Pietro","NOKIA Bell Labs, Nozay, France; NOKIA Bell Labs, Nozay, France; Thales, Dubai, UAE; College of Science and Engineering, ICT Division, Hamad Bin Khalifa University, Doha, Qatar","IEEE Access","28 Sep 2020","2020","8","","173481","173490","Anomaly detection tools play a role of paramount importance in protecting networks and systems from unforeseen attacks, usually by automatically recognizing and filtering out anomalous activities. Over the years, different approaches have been designed, all focused on lowering the false positive rate. However, no proposal has addressed attacks specifically targeting blockchain-based systems. In this paper, we present BAD: Blockchain Anomaly Detection. This is the first solution, to the best of our knowledge, that is tailored to detect anomalies in blockchain-based systems. BAD is a complete framework, relying on several components leveraging, at its core, blockchain meta-data in order to collect potentially malicious activities. BAD enjoys some unique features: (i) it is distributed (thus avoiding any central point of failure); (ii) it is tamper-proof (making it impossible for a malicious software to remove or to alter its own traces); (iii) it is trusted (any behavioral data is collected and verified by the majority of the network); and, (iv) it is private (avoiding any third party to collect/analyze/store sensitive information). Our proposal is described in detail and validated via both experimental results and analysis, that highlight the quality and viability of our Blockchain Anomaly Detection solution.","2169-3536","","10.1109/ACCESS.2020.3025622","Qatar National Library; ","https://ieeexplore.ieee.org/stamp/stamp.jsp?arnumber=9201454","Blockchain technology;security;intrusion detection systems;distributed systems","Anomaly detection;Peer-to-peer computing;Tools;Protocols;Analytical models","cryptography;distributed databases;meta data","blockchain-based systems;BAD;blockchain meta-data;blockchain anomaly detection solution;unforeseen attacks;malicious activities","","3","","43","CCBY","21 Sep 2020","","","IEEE","IEEE Journals"
"<italic>Meta-WF</italic>: Meta-Learning-Based Few-Shot Wireless Impersonation Detection for Wi-Fi Networks","T. Li; Z. Hong; L. Liu; Z. Wen; L. Yu","Institute of Cyberspace Security, Zhejiang University of Technology, Hangzhou, China; Institute of Cyberspace Security, Zhejiang University of Technology, Hangzhou, China; Institute of Cyberspace Security, Zhejiang University of Technology, Hangzhou, China; Institute of Cyberspace Security, Zhejiang University of Technology, Hangzhou, China; Institute of Cyberspace Security, Zhejiang University of Technology, Hangzhou, China","IEEE Communications Letters","10 Nov 2021","2021","25","11","3585","3589","As the common wireless open medium of the Internet of Things (IoT), Wi-Fi networks are often suffering from impersonation attacks. For the purpose of Wi-Fi impersonation attack detection (WIAD), recently, deep learning-based techniques provide superior detection performance. However, considering the dynamics of the WIAD task, these methods require retraining deep learning network (DNN) through large-scale samples and long training time to adapt to new WIAD tasks. In this letter, we propose a meta-learning-based Wi-Fi impersonation detection (<italic>Meta-WF</italic>) algorithm, which learns knowledge from historical multiple WIAD scenarios and quickly adapts to new WIAD scenarios with few-shot samples. Numerical results show that the proposed algorithm is capable of achieving 98% accuracy for new WIAD tasks by 1-step fine-tune using less than 0.1% (50-shot) of the training set samples.","1558-2558","","10.1109/LCOMM.2021.3112518","National Natural Science Foundation of China(grant numbers:62072408,62073292); Zhejiang Provincial Natural Science Foundation of China(grant numbers:LY20F020030); New Century 151 Talent Project of Zhejiang Province; ","https://ieeexplore.ieee.org/stamp/stamp.jsp?arnumber=9551984","Internet of Things (IoT);Wi-Fi network;impersonation attack;deep learning;meta-learning","Task analysis;Feature extraction;Wireless fidelity;Training;Protocols;Deep learning;Heuristic algorithms","","","","","","22","IEEE","29 Sep 2021","","","IEEE","IEEE Journals"
"Attacker Identification and Intrusion Detection for In-Vehicle Networks","J. Ning; J. Wang; J. Liu; N. Kato","State Key Laboratory of Integrated Services Networks, Xidian University, Xi’an, China; State Key Laboratory of Integrated Services Networks, Xidian University, Xi’an, China; School of Cybersecurity, Northwestern Polytechnical University, Xi’an, China; Graduate School of Information Sciences, Tohoku University, Sendai, Japan","IEEE Communications Letters","11 Nov 2019","2019","23","11","1927","1930","As the most wide-spread in-vehicle data bus protocol, CAN (Controller Area Network) has attracted more and more attention due to its lack of security protection mechanism. A variety of attacks against CAN bus have emerged, posing serious threat to vehicle safety. Accordingly, some methods have been proposed to detect CAN bus attacks, however, they have certain shortcomings such as additional computing burden and obvious false detection rate. Therefore, using the physical characteristics of voltage signal on CAN bus, we propose an LOF (Local Outlier Factor)-based intrusion detection method, which can greatly reduce the false detection rate as well as improve the detection accuracy. The modification of CAN protocol and the additional computation burden can also be avoided. In addition, to the best of our knowledge, we are the first to implement bus-off intrusion detection on real vehicles.","1558-2558","","10.1109/LCOMM.2019.2937097","National Natural Science Foundation of China(grant numbers:61771374,61771373,61801360,61601357); Wuhan University(grant numbers:3102019PY005,JB181506,JB181507,JB181508); China 111 Project(grant numbers:B16037); ","https://ieeexplore.ieee.org/stamp/stamp.jsp?arnumber=8811570","Controller area network;intrusion detection;local outlier factor","Intrusion detection;Protocols;Voltage measurement;Anomaly detection;Feature extraction;Dimensionality reduction","controller area networks;security of data;vehicular ad hoc networks","attacker identification;in-vehicle networks;in-vehicle data bus protocol;controller area network;security protection mechanism;vehicle safety;CAN bus attacks;false detection rate;LOF-based intrusion detection method;local outlier factor;CAN protocol","","15","","10","IEEE","23 Aug 2019","","","IEEE","IEEE Journals"
"BotViz: A memory forensic-based botnet detection and visualization approach","I. Sharafaldin; A. Gharib; A. H. Lashkari; A. A. Ghorbani","Canadian Institute for Cybersecurity (CIC), University of New Brunswick (UNB), Canada; Canadian Institute for Cybersecurity (CIC), University of New Brunswick (UNB), Canada; Canadian Institute for Cybersecurity (CIC), University of New Brunswick (UNB), Canada; Canadian Institute for Cybersecurity (CIC), University of New Brunswick (UNB), Canada","2017 International Carnahan Conference on Security Technology (ICCST)","7 Dec 2017","2017","","","1","8","Nowadays, there are many serious cyber security threats such as viruses, worms and trojans but without a doubt botnets are one of the largest threats. Although there are numerous ways to discover botnets and mitigate their effects, most methods have problems effecting detection, due to their evasive characteristics. Also, the majority of previous research uses only one data source (e.g. network traffic), which makes the botnet detection process very difficult over a network. This paper proposes a detection and visualization system, BotViz, to visualize botnets by using memory forensics analysis and a new domain generation algorithm detector. BotViz utilizes machine learning techniques to detect anomalous function hooking behaviors. We established a live Zeus botnet to evaluate the efficiency of the BotViz.","2153-0742","978-1-5386-1585-0","10.1109/CCST.2017.8167804","","https://ieeexplore.ieee.org/stamp/stamp.jsp?arnumber=8167804","Botnet Detection;Botnet Visualization;Domain Generating Algorithm;Memory Forensics","Data visualization;Forensics;Detectors;Security;Monitoring;Algorithm design and analysis","data visualisation;digital forensics;invasive software;learning (artificial intelligence);storage management","evasive characteristics;data source;botnet detection process;visualization system;memory forensics analysis;memory forensic;doubt botnets;botnet visualization;BotViz;Zeus botnet;machine learning;cyber security threats","","1","","53","","7 Dec 2017","","","IEEE","IEEE Conferences"
"A Comprehensive Review on Secure Routing in Internet of Things: Mitigation Methods and Trust-Based Approaches","S. M. Muzammal; R. K. Murugesan; N. Z. Jhanjhi","School of Computer Science and Engineering, Taylor’s University, Subang Jaya, Malaysia; School of Computer Science and Engineering, Taylor’s University, Subang Jaya, Malaysia; School of Computer Science and Engineering, Taylor’s University, Subang Jaya, Malaysia","IEEE Internet of Things Journal","5 Mar 2021","2021","8","6","4186","4210","Internet of Things (IoT) is a network of “things,” connected via Internet, to collect and exchange data. These “things” can be sensors, actuators, smartphones, wearables, computers, or any object that is interconnected to provide specific services. Similarly, wireless sensor network (WSN), as a part of IoT, forwards the gathered data after sensing any event. The scalability and heterogeneity of IoT offer limited protection and is prone to diverse attacks, including WSN-inherited attacks. Moreover, IPv6 routing protocol for low power and lossy networks (RPL), a de facto routing protocol for IoT networks, also suffers from certain vulnerabilities based on its features and functionalities. Researchers have proposed various mitigation mechanisms for secure networks and routing in IoT. Recently, trust-based approaches have gained tremendous interest from the research community to embed security in IoT networks and routing protocols. In the existing literature, several trust models have been introduced according to the security needs of the IoT system, such as SecTrust, DCTM-IoT, CTRUST, etc. In this research, security issues and requirements of IoT networks and RPL routing protocol are studied with respect to various attacks, such as Blackhole, Spoofing, Rank, etc. Additionally, various mitigation methods and significance of trust models in IoT for secure routing are analyzed. Further, trust metrics in IoT environments, including the open issues and research challenges, as well as the implication of trust as a security paradigm in IoT networks and routing protocols are discussed.","2327-4662","","10.1109/JIOT.2020.3031162","Taylor’s University, Malaysia through its Taylor’s Ph.D. Scholarship Programme; ","https://ieeexplore.ieee.org/stamp/stamp.jsp?arnumber=9223748","Internet of Things (IoT);RPL attacks;secure routing;security;trust","Internet of Things;Security;Routing;Routing protocols;Wireless sensor networks;Measurement","computer network security;Internet of Things;IP networks;routing protocols;telecommunication network topology;wireless sensor networks","IoT networks;routing protocols;trust models;IoT system;DCTM-IoT;RPL routing protocol;mitigation methods;secure routing;IoT environments;trust-based approaches;wireless sensor network;IPv6 routing protocol;lossy networks;facto routing protocol;secure networks","","9","","182","IEEE","14 Oct 2020","","","IEEE","IEEE Journals"
"Survey on Collaborative Smart Drones and Internet of Things for Improving Smartness of Smart Cities","S. H. Alsamhi; O. Ma; M. S. Ansari; F. A. Almalki","School of Aerospace Engineering, Tsinghua University, Beijing, China; College of Engineering and Applied Science, University of Cincinnati, Cincinnati, OH, USA; Software Research Institute, Athlone Institute of Technology, Athlone, Ireland; Department of Electronics Engineering, Taif University, Taif, Saudi Arabia","IEEE Access","18 Sep 2019","2019","7","","128125","128152","Smart cities contain intelligent things which can intelligently automatically and collaboratively enhance life quality, save people's lives, and act a sustainable resource ecosystem. To achieve these advanced collaborative technologies such as drones, robotics, artificial intelligence, and Internet of Things (IoT) are required to increase the smartness of smart cities by improving the connectivity, energy efficiency, and quality of services (QoS). Therefore, collaborative drones and IoT play a vital role in supporting a lot of smart-city applications such as those involved in communication, transportation, agriculture,safety and security, disaster mitigation, environmental protection, service delivery, energy saving, e-waste reduction, weather monitoring, healthcare, etc. This paper presents a survey of the potential techniques and applications of collaborative drones and IoT which have recently been proposed in order to increase the smartness of smart cities. It provides a comprehensive overview highlighting the recent and ongoing research on collaborative drone and IoT in improving the real-time application of smart cities. This survey is different from previous ones in term of breadth, scope, and focus. In particular, we focus on the new concept of collaborative drones and IoT for improving smart-city applications. This survey attempts to show how collaborative drones and IoT improve the smartness of smart cities based on data collection, privacy and security, public safety, disaster management, energy consumption and quality of life in smart cities. It mainly focuses on the measurement of the smartness of smart cities, i.e., environmental aspects, life quality, public safety, and disaster management.","2169-3536","","10.1109/ACCESS.2019.2934998","Tsinghua University; ","https://ieeexplore.ieee.org/stamp/stamp.jsp?arnumber=8795473","ICT;smart city;energy consumption;smart drone;IoT;pollutions;gathering data;IoD;disaster;public safety;security and privacy;collaborative drone;IoT","Drones;Smart cities;Internet of Things;Collaboration;Monitoring;Safety;Security","disasters;groupware;Internet of Things;quality of service;remotely operated vehicles;smart cities","IoT;smart cities;collaborative smart drones;energy consumption;disaster management;data security;data privacy;data collection;quality of services;sustainable resource ecosystem;Internet of Things","","27","","231","CCBY","13 Aug 2019","","","IEEE","IEEE Journals"
"IEEE Draft Standard for Biometric Open Protocol","",,"IEEE P2410/D3, December 2018","13 Nov 2018","2018","","","1","29","Identity assertion, role gathering, multilevel access control, assurance, and auditing are provided by the Biometric Open Protocol Standard (BOPS). An implementation of the BOPS III spec is described, which includes both the software running on the client device as well as the server. Pluggable components are allowed to replace existing components’ functionality, accepting integration into current operating environments in a short period of time. A “point-and-cut” mechanism to add the appropriate security to both development and production systems is offered through the BOPS implementation functionality. Homomorphic encryption and a tremendous simplification of the API are also described.","","978-1-5044-5312-7","","","https://ieeexplore.ieee.org/stamp/stamp.jsp?arnumber=8533643","This standard provides a biometric-agnostic security protocol for authentication;identification;and liveness.","IEEE Standards;Biometrics (access control);Access control;Security of data;Open systems;Protocols","","","","","","","","13 Nov 2018","","","IEEE","IEEE Standards"
"Towards Early Detection of Novel Attack Patterns through the Lens of a Large-Scale Darknet","T. Ban; S. Pang; M. Eto; D. Inoue; K. Nakao; R. Huang","Unitec Inst. of Technol., Auckland, New Zealand; Unitec Inst. of Technol., Auckland, New Zealand; Unitec Inst. of Technol., Auckland, New Zealand; Unitec Inst. of Technol., Auckland, New Zealand; Unitec Inst. of Technol., Auckland, New Zealand; Unitec Inst. of Technol., Auckland, New Zealand","2016 Intl IEEE Conferences on Ubiquitous Intelligence & Computing, Advanced and Trusted Computing, Scalable Computing and Communications, Cloud and Big Data Computing, Internet of People, and Smart World Congress (UIC/ATC/ScalCom/CBDCom/IoP/SmartWorld)","16 Jan 2017","2016","","","341","349","Darknet monitoring provides a cost-effective way to monitor the global trend of cyber-threats in the Internet. To make full use of the darknet traffic at hand, in this paper, we present a study on early detection of emerging novel attacks observed in the darknet. First, exploration of the regularities in the communications from attacking hosts are done by feeding all observed packets in the darknet to a frequent itemset mining engine, where the most frequently occurred attack patterns are automatically grouped together. Second, a time series which characterizes the activity level of each attack pattern is created over the observation period. Then, to extract the most prominent attack patterns, a clustering algorithm is engaged to cluster the attack patterns into groups that carry the similar activities in a long run, dimension reduction is employed to provide visual hints about their relationship. Finally, attacks featured by a recent rapid increase are picked up to be further inspected by security experts for incident handling purpose. The experiments show that the proposed scheme is effective, efficient in early detection of new attack patterns from conventional approaches.","","978-1-5090-2771-2","10.1109/UIC-ATC-ScalCom-CBDCom-IoP-SmartWorld.2016.0068","","https://ieeexplore.ieee.org/stamp/stamp.jsp?arnumber=7816864","Cybersecurity;Network traffic analysis;darknet analysis;association rule mining","Monitoring;Time series analysis;Clustering algorithms;Itemsets;Data mining;Internet;Security","computer network security;data mining;pattern clustering;telecommunication traffic","attack pattern detection;large-scale darknet monitoring;cyber-threats;darknet traffic;frequent itemset mining engine;activity level;attack pattern clustering","","3","1","22","","16 Jan 2017","","","IEEE","IEEE Conferences"
"TLP-IDS: A Two-layer Intrusion Detection System for Integrated Electronic Systems","X. Liu; D. He; Y. Gao; S. Zhu; S. Chan","East China Normal University,School of Software Engineering,Shanghai,China; East China Normal University,School of Software Engineering,Shanghai,China; East China Normal University,School of Software Engineering,Shanghai,China; Pennsylvania State University,Department of Computer Science and Engineering,Pennsylvania,United States; City University of Hong Kong,Department of Electrical Engineering,Hong Kong SAR,China","2020 International Symposium on Reliable Distributed Systems (SRDS)","12 Nov 2020","2020","","","205","214","With the increasing applications of integrated electronic systems (IESs), especially in security critical application scenarios like satellites and aircraft, new vulnerabilities and attacks have emerged recently. To detect the attacks, we propose TLP-IDS, a real-time intrusion detection system (IDS). TLP-IDS includes two layers of detection modules, one based on time and sequence logic and the other based on historical data. For the modules in the first layer, periodic and aperiodic messages are distinguished based on variations of message intervals, and we learnd from the idea of Markov decision process (MDP) in reinforcement learning (RL) to automatically learn the logical relationship between sequences. In the second layer, an online sequence extreme learning machine (OS-ELM) method is deployed to fit the data and further combined with the Weibull distribution function for prediction and detection. To evaluate our system, we implement several attack scenarios on a test bed, and measure the detection performance. Experimental results show that our system can quickly and effectively detect various attacks.","2575-8462","978-1-7281-7626-0","10.1109/SRDS51746.2020.00028","National Natural Science Foundation of China; Ministry of Education; ","https://ieeexplore.ieee.org/stamp/stamp.jsp?arnumber=9252065","Intrusion detection;Integrated electronic system;1553B bus","Satellites;Intrusion detection;Aerospace electronics;Real-time systems;Security;Weibull distribution;Reliability","electronic engineering computing;feedforward neural nets;integrated circuits;learning (artificial intelligence);Markov processes;security of data;Weibull distribution","periodic messages;aperiodic messages;online sequence extreme learning machine;TLP-IDS;two-layer intrusion detection system;integrated electronic systems;security critical application scenarios;real-time intrusion detection system;sequence logic;time logic;reinforcement learning;Markov decision process","","","","21","","12 Nov 2020","","","IEEE","IEEE Conferences"
